{
  "schema_version": 1,
  "source": {
    "file": "revised.e2k",
    "program": "ETABS",
    "program_version": "20.3.0",
    "file_units": {
      "force": "KIP",
      "length": "FT",
      "temperature": "F"
    }
  },
  "units": {
    "force": "KIP",
    "length": "FT",
    "temperature": "F"
  },
  "stories": [
    {
      "name": "BASE",
      "elev": 0.0,
      "height": null
    },
    {
      "name": "L2",
      "elev": 14.0,
      "height": 14.0
    },
    {
      "name": "L3",
      "elev": 26.0,
      "height": 12.0
    },
    {
      "name": "ROOF",
      "elev": 38.0,
      "height": 12.0
    }
  ],
  "grids": [
    {
      "system": "G1",
      "label": "1",
      "dir": "X",
      "coord": 0.0
    },
    {
      "system": "G1",
      "label": "2",
      "dir": "X",
      "coord": 25.0
    },
    {
      "system": "G1",
      "label": "3",
      "dir": "X",
      "coord": 50.0
    },
    {
      "system": "G1",
      "label": "A",
      "dir": "Y",
      "coord": 0.0
    },
    {
      "system": "G1",
      "label": "B",
      "dir": "Y",
      "coord": 30.0
    }
  ],
  "points": [
    {
      "id": "10@L2",
      "label": "10",
      "story": "L2",
      "coords": [
        [25.0, 10.004, 14.0]
      ],
      "assigns": {},
      "loads": {}
    },
    {
      "id": "11@L2",
      "label": "11",
      "story": "L2",
      "coords": [
        [25.0, 22.0, 14.0]
      ],
      "assigns": {},
      "loads": {}
    },
    {
      "id": "12@L2",
      "label": "12",
      "story": "L2",
      "coords": [
        [50.0, 22.0, 14.0]
      ],
      "assigns": {},
      "loads": {}
    },
    {
      "id": "1@BASE",
      "label": "1",
      "story": "BASE",
      "coords": [
        [0.0, 0.0, 0.0]
      ],
      "assigns": {
        "RESTRAINT": "UX UY UZ RX RY RZ"
      },
      "loads": {}
    },
    {
      "id": "1@L2",
      "label": "1",
      "story": "L2",
      "coords": [
        [0.0, 0.0, 14.0]
      ],
      "assigns": {},
      "loads": {}
    },
    {
      "id": "1@L3",
      "label": "1",
      "story": "L3",
      "coords": [
        [0.0, 0.0, 26.0]
      ],
      "assigns": {},
      "loads": {}
    },
    {
      "id": "1@ROOF",
      "label": "1",
      "story": "ROOF",
      "coords": [
        [0.0, 0.0, 38.0]
      ],
      "assigns": {},
      "loads": {}
    },
    {
      "id": "2@BASE",
      "label": "2",
      "story": "BASE",
      "coords": [
        [25.0, 0.0, 0.0]
      ],
      "assigns": {
        "RESTRAINT": "UX UY UZ RX RY RZ"
      },
      "loads": {}
    },
    {
      "id": "2@L2",
      "label": "2",
      "story": "L2",
      "coords": [
        [25.0, 0.0, 14.0]
      ],
      "assigns": {},
      "loads": {}
    },
    {
      "id": "2@L3",
      "label": "2",
      "story": "L3",
      "coords": [
        [25.0, 0.0, 26.0]
      ],
      "assigns": {},
      "loads": {}
    },
    {
      "id": "2@ROOF",
      "label": "2",
      "story": "ROOF",
      "coords": [
        [25.0, 0.0, 38.0]
      ],
      "assigns": {},
      "loads": {}
    },
    {
      "id": "3@BASE",
      "label": "3",
      "story": "BASE",
      "coords": [
        [50.0, 0.0, 0.0]
      ],
      "assigns": {
        "RESTRAINT": "UX UY UZ RX RY RZ"
      },
      "loads": {}
    },
    {
      "id": "3@L2",
      "label": "3",
      "story": "L2",
      "coords": [
        [50.0, 0.0, 14.0]
      ],
      "assigns": {},
      "loads": {}
    },
    {
      "id": "3@L3",
      "label": "3",
      "story": "L3",
      "coords": [
        [50.0, 0.0, 26.0]
      ],
      "assigns": {},
      "loads": {}
    },
    {
      "id": "3@ROOF",
      "label": "3",
      "story": "ROOF",
      "coords": [
        [50.0, 0.0, 38.0]
      ],
      "assigns": {},
      "loads": {}
    },
    {
      "id": "4@BASE",
      "label": "4",
      "story": "BASE",
      "coords": [
        [0.0, 30.0, 0.0]
      ],
      "assigns": {
        "RESTRAINT": "UX UY UZ RX RY RZ"
      },
      "loads": {}
    },
    {
      "id": "4@L2",
      "label": "4",
      "story": "L2",
      "coords": [
        [0.0, 30.0, 14.0]
      ],
      "assigns": {},
      "loads": {}
    },
    {
      "id": "4@L3",
      "label": "4",
      "story": "L3",
      "coords": [
        [0.0, 30.0, 26.0]
      ],
      "assigns": {},
      "loads": {}
    },
    {
      "id": "4@ROOF",
      "label": "4",
      "story": "ROOF",
      "coords": [
        [0.0, 30.0, 38.0]
      ],
      "assigns": {},
      "loads": {}
    },
    {
      "id": "5@BASE",
      "label": "5",
      "story": "BASE",
      "coords": [
        [25.0, 30.0, 0.0]
      ],
      "assigns": {
        "RESTRAINT": "UX UY UZ RX RY RZ"
      },
      "loads": {}
    },
    {
      "id": "5@L2",
      "label": "5",
      "story": "L2",
      "coords": [
        [25.0, 30.0, 14.0]
      ],
      "assigns": {},
      "loads": {}
    },
    {
      "id": "5@L3",
      "label": "5",
      "story": "L3",
      "coords": [
        [25.0, 30.0, 26.0]
      ],
      "assigns": {},
      "loads": {}
    },
    {
      "id": "5@ROOF",
      "label": "5",
      "story": "ROOF",
      "coords": [
        [25.0, 30.0, 38.0]
      ],
      "assigns": {},
      "loads": {}
    },
    {
      "id": "6@BASE",
      "label": "6",
      "story": "BASE",
      "coords": [
        [50.0, 30.0, 0.0]
      ],
      "assigns": {
        "RESTRAINT": "UX UY UZ RX RY RZ"
      },
      "loads": {}
    },
    {
      "id": "6@L2",
      "label": "6",
      "story": "L2",
      "coords": [
        [50.0, 30.0, 14.0]
      ],
      "assigns": {},
      "loads": {}
    },
    {
      "id": "6@L3",
      "label": "6",
      "story": "L3",
      "coords": [
        [50.0, 30.0, 26.0]
      ],
      "assigns": {},
      "loads": {}
    },
    {
      "id": "6@ROOF",
      "label": "6",
      "story": "ROOF",
      "coords": [
        [50.0, 30.0, 38.0]
      ],
      "assigns": {},
      "loads": {
        "SDL": [
          {
            "TYPE": "FORCE",
            "FZ": -5.0
          }
        ]
      }
    },
    {
      "id": "7@L3",
      "label": "7",
      "story": "L3",
      "coords": [
        [12.5, 0.0, 26.0]
      ],
      "assigns": {},
      "loads": {}
    },
    {
      "id": "8@L3",
      "label": "8",
      "story": "L3",
      "coords": [
        [12.5, 30.0, 26.0]
      ],
      "assigns": {},
      "loads": {}
    },
    {
      "id": "9@L2",
      "label": "9",
      "story": "L2",
      "coords": [
        [0.0, 10.004, 14.0]
      ],
      "assigns": {},
      "loads": {}
    }
  ],
  "frames": [
    {
      "id": "B10@L2",
      "label": "B10",
      "story": "L2",
      "type": "BEAM",
      "nodes": [
        {"point": "11", "story": "L2"},
        {"point": "12", "story": "L2"}
      ],
      "coords": [
        [25.0, 22.0, 14.0],
        [50.0, 22.0, 14.0]
      ],
      "assigns": {
        "SECTION": "W18X35",
        "MAXSTASPC": 2.0,
        "AUTOMESH": "YES",
        "MESHATINTERSECTIONS": "YES"
      },
      "loads": {}
    },
    {
      "id": "B1@L2",
      "label": "B1",
      "story": "L2",
      "type": "BEAM",
      "nodes": [
        {"point": "1", "story": "L2"},
        {"point": "2", "story": "L2"}
      ],
      "coords": [
        [0.0, 0.0, 14.0],
        [25.0, 0.0, 14.0]
      ],
      "assigns": {
        "SECTION": "W18X35",
        "MAXSTASPC": 2.0,
        "AUTOMESH": "YES",
        "MESHATINTERSECTIONS": "YES"
      },
      "loads": {
        "SDL": [
          {
            "TYPE": "UNIFF",
            "DIR": "GRAV",
            "FVAL": 0.3
          }
        ]
      }
    },
    {
      "id": "B1@L3",
      "label": "B1",
      "story": "L3",
      "type": "BEAM",
      "nodes": [
        {"point": "1", "story": "L3"},
        {"point": "2", "story": "L3"}
      ],
      "coords": [
        [0.0, 0.0, 26.0],
        [25.0, 0.0, 26.0]
      ],
      "assigns": {
        "SECTION": "W18X35",
        "MAXSTASPC": 2.0,
        "AUTOMESH": "YES",
        "MESHATINTERSECTIONS": "YES"
      },
      "loads": {
        "SDL": [
          {
            "TYPE": "UNIFF",
            "DIR": "GRAV",
            "FVAL": 0.3
          }
        ]
      }
    },
    {
      "id": "B1@ROOF",
      "label": "B1",
      "story": "ROOF",
      "type": "BEAM",
      "nodes": [
        {"point": "1", "story": "ROOF"},
        {"point": "2", "story": "ROOF"}
      ],
      "coords": [
        [0.0, 0.0, 38.0],
        [25.0, 0.0, 38.0]
      ],
      "assigns": {
        "SECTION": "W18X35",
        "MAXSTASPC": 2.0,
        "AUTOMESH": "YES",
        "MESHATINTERSECTIONS": "YES"
      },
      "loads": {}
    },
    {
      "id": "B2@L2",
      "label": "B2",
      "story": "L2",
      "type": "BEAM",
      "nodes": [
        {"point": "2", "story": "L2"},
        {"point": "3", "story": "L2"}
      ],
      "coords": [
        [25.0, 0.0, 14.0],
        [50.0, 0.0, 14.0]
      ],
      "assigns": {
        "SECTION": "W18X35",
        "MAXSTASPC": 2.0,
        "AUTOMESH": "YES",
        "MESHATINTERSECTIONS": "YES"
      },
      "loads": {}
    },
    {
      "id": "B2@L3",
      "label": "B2",
      "story": "L3",
      "type": "BEAM",
      "nodes": [
        {"point": "2", "story": "L3"},
        {"point": "3", "story": "L3"}
      ],
      "coords": [
        [25.0, 0.0, 26.0],
        [50.0, 0.0, 26.0]
      ],
      "assigns": {
        "SECTION": "W24X55",
        "MAXSTASPC": 2.0,
        "AUTOMESH": "YES",
        "MESHATINTERSECTIONS": "YES"
      },
      "loads": {}
    },
    {
      "id": "B2@ROOF",
      "label": "B2",
      "story": "ROOF",
      "type": "BEAM",
      "nodes": [
        {"point": "2", "story": "ROOF"},
        {"point": "3", "story": "ROOF"}
      ],
      "coords": [
        [25.0, 0.0, 38.0],
        [50.0, 0.0, 38.0]
      ],
      "assigns": {
        "SECTION": "W18X35",
        "MAXSTASPC": 2.0,
        "AUTOMESH": "YES",
        "MESHATINTERSECTIONS": "YES"
      },
      "loads": {}
    },
    {